[
  {
    "page_id": "cp-studio-pages",
    "version": "1.0.0",
    "status": "released",
    "layout_instance_id": "layout-1",
    "widget_instance_ids": [],
    "nav_binding_ids": [],
    "design_version_lock": "v1",
    "checksum": "seed",
    "rollback_ref": "",
    "created_by": "bootstrap",
    "created_at": "2026-02-14T21:25:52.820186Z",
    "diff_ref": ""
  },
  {
    "page_id": "cp-studio-routes",
    "version": "1.0.0",
    "status": "released",
    "layout_instance_id": "layout-1",
    "widget_instance_ids": [],
    "nav_binding_ids": [],
    "design_version_lock": "v1",
    "checksum": "seed",
    "rollback_ref": "",
    "created_by": "bootstrap",
    "created_at": "2026-02-14T21:25:52.820482Z",
    "diff_ref": ""
  },
  {
    "page_id": "cp-studio-nav",
    "version": "1.0.0",
    "status": "released",
    "layout_instance_id": "layout-1",
    "widget_instance_ids": [],
    "nav_binding_ids": [],
    "design_version_lock": "v1",
    "checksum": "seed",
    "rollback_ref": "",
    "created_by": "bootstrap",
    "created_at": "2026-02-14T21:25:52.820489Z",
    "diff_ref": ""
  },
  {
    "page_id": "cp-studio-releases",
    "version": "1.0.0",
    "status": "released",
    "layout_instance_id": "layout-1",
    "widget_instance_ids": [],
    "nav_binding_ids": [],
    "design_version_lock": "v1",
    "checksum": "seed",
    "rollback_ref": "",
    "created_by": "bootstrap",
    "created_at": "2026-02-14T21:25:52.820493Z",
    "diff_ref": ""
  },
  {
    "page_id": "cp-studio-health",
    "version": "1.0.0",
    "status": "released",
    "layout_instance_id": "layout-1",
    "widget_instance_ids": [],
    "nav_binding_ids": [],
    "design_version_lock": "v1",
    "checksum": "seed",
    "rollback_ref": "",
    "created_by": "bootstrap",
    "created_at": "2026-02-14T21:25:52.820496Z",
    "diff_ref": ""
  }
]